{
  "$schema": "diagnostic-freeze.v1.schema.json",
  "schema_version": "diagnostic-freeze.v1",
  "freeze_id": "diagnostic-freeze:accela-rv64gc-finals-2026-r7-0c95767",
  "campaign_id": "accela-rv64gc-finals-2026-r7-0c95767",
  "classification": "diagnostic_aborted_direction_mismatch",
  "reason": "evaluation_direction_mismatch",
  "recorded_at": "2026-08-10T15:40:10.516Z",
  "evidence_cutoff_at": "2026-08-10T15:07:29.490Z",
  "eligibility": {
    "diagnostic_only": true,
    "ranking_eligible": false,
    "promotion_eligible": false,
    "auto_resume_allowed": false,
    "manual_resume_allowed": false,
    "report_as_formal_result": false
  },
  "source_revision": {
    "repository_commit": "0c957676856e7209deb15d1fefa3f10429c9d277",
    "repository_tree": "6202a8c48513fabd7201fa52f99b465563a2c97c",
    "repository_dirty": false,
    "workspace_class": "wsl_native_linux"
  },
  "artifact_namespace": {
    "root_key": "repository-and-ignored-r7-evidence",
    "contains_local_absolute_path": false,
    "resolution_rule": "Resolve repository/ keys against the frozen Git tree and campaign/ or runs/ keys against the separately supplied frozen r7 evidence root."
  },
  "bindings": {
    "campaign_plan": {
      "artifact_key": "campaign/initial.plan.json",
      "physical_sha256": "e5cfa99839e859469ff4c1538571c822d496cf8d1bb0994acafb6535b91c545c",
      "canonical_sha256": "d5032ec20dc33cd3388ea4bb24ec2cf359d282c5a1ef6bcef15d0359d0d9a737",
      "schema_version": "campaign-plan.v1"
    },
    "measurement_protocols": [
      {
        "artifact_key": "repository/docs/optimization/data/measurement-protocol.v1.json",
        "physical_sha256": "ebd1871503f9e131ba3dd36672bf5450eec1e12312c51cadb08b73b32e3f6e39",
        "canonical_sha256": "00de39da36b1cf7e0fe5bd21545e4e5b01d800e03eaefbf33a7935f6eeb66548",
        "schema_version": "measurement-protocol.v1"
      },
      {
        "artifact_key": "repository/docs/optimization/data/measurement-protocol.cache-hotblock.v1.json",
        "physical_sha256": "8ddd3bfb33f7f5d3439bc6c20d92788ebed8c69992547bec1eecdaff1991b9d5",
        "canonical_sha256": "3a7203bb2fb31756f40bb7bf216165cf28b4595061eed33fe2b23b9a4f02d4f8",
        "schema_version": "measurement-protocol.v1"
      }
    ],
    "controllers": [
      {
        "artifact_key": "campaign/run-formal-b1.sh",
        "physical_sha256": "bb1356b4e30e68b4453180962104c4436247942563345b4d88fb56377356cbf2"
      },
      {
        "artifact_key": "campaign/run-formal-b3-b2.sh",
        "physical_sha256": "f22fc0b6251a9c64c395797b76972ff73b2cf6923d108fe364707114b5cc4c17"
      }
    ],
    "run_evidence_registry": {
      "artifact_key": "campaign/run-evidence.tsv",
      "physical_sha256": "fef0e9f1ea0df2cb82b3649a8be74574481f71003d7e2739235ae5e338bd2e69",
      "line_count": 21,
      "completed_count": 20,
      "failed_count": 1,
      "partial_run_registered": false
    },
    "status_ledger": {
      "first_sequence": 0,
      "last_sequence": 27,
      "entry_count": 28,
      "aggregate_fingerprint_algorithm": "sha256(concat(utf8(basename),NUL,raw_sha256_bytes)) in sequence order",
      "aggregate_fingerprint_sha256": "d71f781943de3d902267c808f72febd42e41cadaf1bb7f437a9d86020450e1b5",
      "entries": [
        {
          "sequence": 0,
          "artifact_key": "campaign/status/000-initial.status.json",
          "physical_sha256": "02ad7df1782be30fc304fbab16938013daca96fc65669a0a04afa0494ba0d219",
          "canonical_sha256": "ed24d804aaf6e8d8e45b0f1e06c9bb66c2300fe945661c06918a05ec1f18fda0",
          "as_of": "2026-08-10T12:27:58.033Z",
          "state": "pending"
        },
        {
          "sequence": 1,
          "artifact_key": "campaign/status/001-run-evidence.status.json",
          "physical_sha256": "0e4961edf4db63b2f99922c24b428b6c4fb04005b19cdebc3e702770ddf7a35d",
          "canonical_sha256": "cab1a152c02fb2e83d417360213b7d27e28ea78311d5bd4a6359b36d75146016",
          "as_of": "2026-08-10T12:58:47.414Z",
          "state": "running"
        },
        {
          "sequence": 2,
          "artifact_key": "campaign/status/002-run-evidence.status.json",
          "physical_sha256": "0915d482a95e4c1566b699fb370ab990df8b3e6df62c87c7bb85ff71035ec679",
          "canonical_sha256": "58eb75790446c065a6267877ef64f89818d1ce8dfe34963678d28135bf3876d0",
          "as_of": "2026-08-10T13:25:05.624Z",
          "state": "running"
        },
        {
          "sequence": 3,
          "artifact_key": "campaign/status/003-run-evidence.status.json",
          "physical_sha256": "2d2dc51484ae76ddefaafe875ae3bf1bc29b2919bb513b02d3c5420aa3114d9f",
          "canonical_sha256": "4d1010bc88c696bb128738bd8eaafac384121a023a87ba15f87153d0a7d8226e",
          "as_of": "2026-08-10T13:29:19.192Z",
          "state": "running"
        },
        {
          "sequence": 4,
          "artifact_key": "campaign/status/004-run-evidence.status.json",
          "physical_sha256": "c5f2935edbf6723af87b853d035b6ed6b3ef51deecdc0309fee57c4b415cc1fe",
          "canonical_sha256": "56b487899fae1b3d5274866aedeb193a0d84c29620a617c8d1b5e276dde48053",
          "as_of": "2026-08-10T13:32:31.413Z",
          "state": "running"
        },
        {
          "sequence": 5,
          "artifact_key": "campaign/status/005-run-evidence.status.json",
          "physical_sha256": "9574718a83519fe64c20abe8a421ca5db23d667236c7c5ac3d4bf96fe0aae629",
          "canonical_sha256": "54604a5f3e171bd1f6dcba890b7ca4aacdbeb91f4c69e58a73f3a8b20dbc1c67",
          "as_of": "2026-08-10T13:35:55.198Z",
          "state": "running"
        },
        {
          "sequence": 6,
          "artifact_key": "campaign/status/006-run-evidence.status.json",
          "physical_sha256": "192466946da7700a21cda7fa42476c4a01327354fff1a587875ef539973c0e5a",
          "canonical_sha256": "2f360b731c1016046f35f9b5450a507dc6088bcdc99cbf9cade7cca027d47a99",
          "as_of": "2026-08-10T13:38:40.769Z",
          "state": "running"
        },
        {
          "sequence": 7,
          "artifact_key": "campaign/status/007-run-evidence.status.json",
          "physical_sha256": "4ef5b485db69a91ed48cda567ee2c6b926cd0ca7c653e2faff58e80361053fd9",
          "canonical_sha256": "18b35906cc98db073e776afb956ef9b48f7fac38397ec9a2a3b8d59fe37ddfa1",
          "as_of": "2026-08-10T13:41:09.928Z",
          "state": "running"
        },
        {
          "sequence": 8,
          "artifact_key": "campaign/status/008-run-evidence.status.json",
          "physical_sha256": "db930549e636b4f6d160a7adf3f2c61bc6cd87173de9ac1f5197aa383f90a374",
          "canonical_sha256": "dc0315ab6f44c0c7b4e99328682aff6fcaa76541e93565f36491dc0d954316b0",
          "as_of": "2026-08-10T14:08:57.866Z",
          "state": "running"
        },
        {
          "sequence": 9,
          "artifact_key": "campaign/status/009-run-evidence.status.json",
          "physical_sha256": "956637ab3e606c6f7ad0aa3e4d167efdded6aeeba8031658a1311fd018427490",
          "canonical_sha256": "7455a841fa18b82a6d5a6f62381cc060a29703c400858ca03d06bdfbcc46c7ab",
          "as_of": "2026-08-10T14:09:07.137Z",
          "state": "running"
        },
        {
          "sequence": 10,
          "artifact_key": "campaign/status/010-run-evidence.status.json",
          "physical_sha256": "6b3e01d816ce8d3617a34a56fc518b239b38084d9b411c025d2ae151a8a204c4",
          "canonical_sha256": "236bdea3bd55c161b41fa5460f0bfa704289c54478ca44882346c18214f8e864",
          "as_of": "2026-08-10T14:09:14.406Z",
          "state": "running"
        },
        {
          "sequence": 11,
          "artifact_key": "campaign/status/011-run-evidence.status.json",
          "physical_sha256": "93a8165d2f1c3f76176395b18e58aec8541ab6987e7fdd39a29191084bdf46b5",
          "canonical_sha256": "763d7d7940ca7b8bfbae540c6c4ace99a8f6000ede1b61df16863dd46f8b25e4",
          "as_of": "2026-08-10T14:09:21.142Z",
          "state": "running"
        },
        {
          "sequence": 12,
          "artifact_key": "campaign/status/012-run-evidence.status.json",
          "physical_sha256": "9839fac1c42a77444fabb04e92e78fd45d801e3faf433ea3e67f3698d1cd03b3",
          "canonical_sha256": "ceba8d21d1eb03a4ef43ab922db60dbf28abd3fcfb0ca3268282d240bec0ea04",
          "as_of": "2026-08-10T14:09:28.466Z",
          "state": "running"
        },
        {
          "sequence": 13,
          "artifact_key": "campaign/status/013-run-evidence.status.json",
          "physical_sha256": "598a74a41be2a978890c7e50937c5ecb3d0d9f83c0b43c10c8f3c55f97000614",
          "canonical_sha256": "048f2b0320ff392459b9e9cd3af01baafda7ce6fd4939182c0f2b2abed18db56",
          "as_of": "2026-08-10T14:09:34.611Z",
          "state": "running"
        },
        {
          "sequence": 14,
          "artifact_key": "campaign/status/014-run-evidence.status.json",
          "physical_sha256": "281294d69f2b6ab671214686d38f7c3bfa4f2ca4bb25ae203e638f48a62d9388",
          "canonical_sha256": "4b857efc16238622216535864fec6f2ddbb93a6d76cf4e35adae227af1ee4132",
          "as_of": "2026-08-10T14:12:57.094Z",
          "state": "running"
        },
        {
          "sequence": 15,
          "artifact_key": "campaign/status/015-run-evidence.status.json",
          "physical_sha256": "67c6c336f106cf9bf0ac7a57e2da20f1cee8c9af7fac30b613500770f279baf3",
          "canonical_sha256": "7c1e797043e3a25803e4c5da768345f7ed3f033c957aef9621bb052b53e9edbe",
          "as_of": "2026-08-10T14:16:14.663Z",
          "state": "running"
        },
        {
          "sequence": 16,
          "artifact_key": "campaign/status/016-run-evidence.status.json",
          "physical_sha256": "6b972a95f1f40c9859f38e1334c6d44a2b1502088b6dffaeab8f847a034e0b5a",
          "canonical_sha256": "f137f86e8e13d067d9948514cef2d7b902d0c8795eca4d3eb4f2c0b40c515c02",
          "as_of": "2026-08-10T14:19:32.606Z",
          "state": "running"
        },
        {
          "sequence": 17,